<?xml version="1.0"?>
<?xml-stylesheet type="text/xsl" href="pdml2html.xsl"?>
<!-- You can find pdml2html.xsl in /usr/share/wireshark or at https://code.wireshark.org/review/gitweb?p=wireshark.git;a=blob_plain;f=pdml2html.xsl. -->
<pdml version="0" creator="wireshark/2.2.0" time="Tue Apr 25 08:27:11 2017" capture_file="rand.pcapng">
<packet>
  <proto name="geninfo" pos="0" showname="General information" size="99">
    <field name="num" pos="0" show="1" showname="Number" value="1" size="99"/>
    <field name="len" pos="0" show="99" showname="Frame Length" value="63" size="99"/>
    <field name="caplen" pos="0" show="99" showname="Captured Length" value="63" size="99"/>
    <field name="timestamp" pos="0" show="Apr 25, 2017 06:01:32.515427121 UTC" showname="Captured Time" value="1493100092.515427121" size="99"/>
  </proto>
  <proto name="frame" showname="Frame 1: 99 bytes on wire (792 bits), 99 bytes captured (792 bits) on interface 0" size="99" pos="0">
    <field name="frame.interface_id" showname="Interface id: 0 (any)" size="0" pos="0" show="0"/>
    <field name="frame.encap_type" showname="Encapsulation type: Linux cooked-mode capture (25)" size="0" pos="0" show="25"/>
    <field name="frame.time" showname="Arrival Time: Apr 25, 2017 06:01:32.515427121 UTC" size="0" pos="0" show="Apr 25, 2017 06:01:32.515427121 UTC"/>
    <field name="frame.offset_shift" showname="Time shift for this packet: 0.000000000 seconds" size="0" pos="0" show="0.000000000"/>
    <field name="frame.time_epoch" showname="Epoch Time: 1493100092.515427121 seconds" size="0" pos="0" show="1493100092.515427121"/>
    <field name="frame.time_delta" showname="Time delta from previous captured frame: 0.000000000 seconds" size="0" pos="0" show="0.000000000"/>
    <field name="frame.time_delta_displayed" showname="Time delta from previous displayed frame: 0.000000000 seconds" size="0" pos="0" show="0.000000000"/>
    <field name="frame.time_relative" showname="Time since reference or first frame: 0.000000000 seconds" size="0" pos="0" show="0.000000000"/>
    <field name="frame.number" showname="Frame Number: 1" size="0" pos="0" show="1"/>
    <field name="frame.len" showname="Frame Length: 99 bytes (792 bits)" size="0" pos="0" show="99"/>
    <field name="frame.cap_len" showname="Capture Length: 99 bytes (792 bits)" size="0" pos="0" show="99"/>
    <field name="frame.marked" showname="Frame is marked: False" size="0" pos="0" show="0"/>
    <field name="frame.ignored" showname="Frame is ignored: False" size="0" pos="0" show="0"/>
    <field name="frame.protocols" showname="Protocols in frame: sll:ethertype:ip:tcp:ssl" size="0" pos="0" show="sll:ethertype:ip:tcp:ssl"/>
  </proto>
  <proto name="sll" showname="Linux cooked capture" size="16" pos="0">
    <field name="sll.pkttype" showname="Packet type: Sent by us (4)" size="2" pos="0" show="4" value="0004"/>
    <field name="sll.hatype" showname="Link-layer address type: 1" size="2" pos="2" show="1" value="0001"/>
    <field name="sll.halen" showname="Link-layer address length: 6" size="2" pos="4" show="6" value="0006"/>
    <field name="sll.src.eth" showname="Source: Azurewav_6b:39:52 (6c:71:d9:6b:39:52)" size="6" pos="6" show="6c:71:d9:6b:39:52" value="6c71d96b3952"/>
    <field name="sll.etype" showname="Protocol: IPv4 (0x0800)" size="2" pos="14" show="0x00000800" value="0800"/>
  </proto>
  <proto name="ip" showname="Internet Protocol Version 4, Src: 192.168.1.100, Dst: 184.84.88.78" size="20" pos="16">
    <field name="ip.version" showname="0100 .... = Version: 4" size="1" pos="16" show="4" value="4" unmaskedvalue="45"/>
    <field name="ip.hdr_len" showname=".... 0101 = Header Length: 20 bytes (5)" size="1" pos="16" show="20" value="45"/>
    <field name="ip.dsfield" showname="Differentiated Services Field: 0x00 (DSCP: CS0, ECN: Not-ECT)" size="1" pos="17" show="0x00000000" value="00">
      <field name="ip.dsfield.dscp" showname="0000 00.. = Differentiated Services Codepoint: Default (0)" size="1" pos="17" show="0" value="0" unmaskedvalue="00"/>
      <field name="ip.dsfield.ecn" showname=".... ..00 = Explicit Congestion Notification: Not ECN-Capable Transport (0)" size="1" pos="17" show="0" value="0" unmaskedvalue="00"/>
    </field>
    <field name="ip.len" showname="Total Length: 83" size="2" pos="18" show="83" value="0053"/>
    <field name="ip.id" showname="Identification: 0x35bf (13759)" size="2" pos="20" show="0x000035bf" value="35bf"/>
    <field name="ip.flags" showname="Flags: 0x02 (Don&#x27;t Fragment)" size="1" pos="22" show="0x00000002" value="40">
      <field name="ip.flags.rb" showname="0... .... = Reserved bit: Not set" size="1" pos="22" show="0" value="40"/>
      <field name="ip.flags.df" showname=".1.. .... = Don&#x27;t fragment: Set" size="1" pos="22" show="1" value="40"/>
      <field name="ip.flags.mf" showname="..0. .... = More fragments: Not set" size="1" pos="22" show="0" value="40"/>
    </field>
    <field name="ip.frag_offset" showname="Fragment offset: 0" size="2" pos="22" show="0" value="4000"/>
    <field name="ip.ttl" showname="Time to live: 64" size="1" pos="24" show="64" value="40"/>
    <field name="ip.proto" showname="Protocol: TCP (6)" size="1" pos="25" show="6" value="06"/>
    <field name="ip.checksum" showname="Header checksum: 0x3237 [validation disabled]" size="2" pos="26" show="0x00003237" value="3237"/>
    <field name="ip.checksum.status" showname="Header checksum status: Unverified" size="0" pos="26" show="2"/>
    <field name="ip.src" showname="Source: 192.168.1.100" size="4" pos="28" show="192.168.1.100" value="c0a80164"/>
    <field name="ip.addr" showname="Source or Destination Address: 192.168.1.100" hide="yes" size="4" pos="28" show="192.168.1.100" value="c0a80164"/>
    <field name="ip.src_host" showname="Source Host: 192.168.1.100" hide="yes" size="4" pos="28" show="192.168.1.100" value="c0a80164"/>
    <field name="ip.host" showname="Source or Destination Host: 192.168.1.100" hide="yes" size="4" pos="28" show="192.168.1.100" value="c0a80164"/>
    <field name="ip.dst" showname="Destination: 184.84.88.78" size="4" pos="32" show="184.84.88.78" value="b854584e"/>
    <field name="ip.addr" showname="Source or Destination Address: 184.84.88.78" hide="yes" size="4" pos="32" show="184.84.88.78" value="b854584e"/>
    <field name="ip.dst_host" showname="Destination Host: 184.84.88.78" hide="yes" size="4" pos="32" show="184.84.88.78" value="b854584e"/>
    <field name="ip.host" showname="Source or Destination Host: 184.84.88.78" hide="yes" size="4" pos="32" show="184.84.88.78" value="b854584e"/>
    <field name="" show="Source GeoIP: Unknown" size="4" pos="28" value="c0a80164"/>
    <field name="" show="Destination GeoIP: United States, AS20940 AKAMAI-ASN1, Cambridge, MA, 42.362598, -71.084297" size="4" pos="32" value="b854584e">
      <field name="ip.geoip.dst_country" showname="Destination GeoIP Country: United States" size="4" pos="32" show="United States" value="b854584e"/>
      <field name="ip.geoip.country" showname="Source or Destination GeoIP Country: United States" hide="yes" size="4" pos="32" show="United States" value="b854584e"/>
      <field name="ip.geoip.dst_asnum" showname="Destination GeoIP AS Number: AS20940 AKAMAI-ASN1" size="4" pos="32" show="AS20940 AKAMAI-ASN1" value="b854584e"/>
      <field name="ip.geoip.asnum" showname="Source or Destination GeoIP AS Number: AS20940 AKAMAI-ASN1" hide="yes" size="4" pos="32" show="AS20940 AKAMAI-ASN1" value="b854584e"/>
      <field name="ip.geoip.dst_city" showname="Destination GeoIP City: Cambridge, MA" size="4" pos="32" show="Cambridge, MA" value="b854584e"/>
      <field name="ip.geoip.city" showname="Source or Destination GeoIP City: Cambridge, MA" hide="yes" size="4" pos="32" show="Cambridge, MA" value="b854584e"/>
      <field name="ip.geoip.dst_lat" showname="Destination GeoIP Latitude: 42.362598" size="4" pos="32" show="42.362598" value="b854584e"/>
      <field name="ip.geoip.lat" showname="Source or Destination GeoIP Latitude: 42.362598" hide="yes" size="4" pos="32" show="42.362598" value="b854584e"/>
      <field name="ip.geoip.dst_lon" showname="Destination GeoIP Longitude: -71.084297" size="4" pos="32" show="-71.084297" value="b854584e"/>
      <field name="ip.geoip.lon" showname="Source or Destination GeoIP Longitude: -71.084297" hide="yes" size="4" pos="32" show="-71.084297" value="b854584e"/>
    </field>
  </proto>
  <proto name="tcp" showname="Transmission Control Protocol, Src Port: 47442, Dst Port: 443, Seq: 1, Ack: 1, Len: 31" size="32" pos="36">
    <field name="tcp.srcport" showname="Source Port: 47442" size="2" pos="36" show="47442" value="b952"/>
    <field name="tcp.dstport" showname="Destination Port: 443" size="2" pos="38" show="443" value="01bb"/>
    <field name="tcp.port" showname="Source or Destination Port: 47442" hide="yes" size="2" pos="36" show="47442" value="b952"/>
    <field name="tcp.port" showname="Source or Destination Port: 443" hide="yes" size="2" pos="38" show="443" value="01bb"/>
    <field name="tcp.stream" showname="Stream index: 0" size="0" pos="36" show="0"/>
    <field name="tcp.len" showname="TCP Segment Len: 31" size="1" pos="48" show="31" value="80"/>
    <field name="tcp.seq" showname="Sequence number: 1    (relative sequence number)" size="4" pos="40" show="1" value="95676b68"/>
    <field name="tcp.nxtseq" showname="Next sequence number: 32    (relative sequence number)" size="0" pos="36" show="32"/>
    <field name="tcp.ack" showname="Acknowledgment number: 1    (relative ack number)" size="4" pos="44" show="1" value="48f536ea"/>
    <field name="tcp.hdr_len" showname="Header Length: 32 bytes" size="1" pos="48" show="32" value="80"/>
    <field name="tcp.flags" showname="Flags: 0x018 (PSH, ACK)" size="2" pos="48" show="0x00000018" value="18" unmaskedvalue="8018">
      <field name="tcp.flags.res" showname="000. .... .... = Reserved: Not set" size="1" pos="48" show="0" value="0" unmaskedvalue="80"/>
      <field name="tcp.flags.ns" showname="...0 .... .... = Nonce: Not set" size="1" pos="48" show="0" value="0" unmaskedvalue="80"/>
      <field name="tcp.flags.cwr" showname=".... 0... .... = Congestion Window Reduced (CWR): Not set" size="1" pos="49" show="0" value="0" unmaskedvalue="18"/>
      <field name="tcp.flags.ecn" showname=".... .0.. .... = ECN-Echo: Not set" size="1" pos="49" show="0" value="0" unmaskedvalue="18"/>
      <field name="tcp.flags.urg" showname=".... ..0. .... = Urgent: Not set" size="1" pos="49" show="0" value="0" unmaskedvalue="18"/>
      <field name="tcp.flags.ack" showname=".... ...1 .... = Acknowledgment: Set" size="1" pos="49" show="1" value="1" unmaskedvalue="18"/>
      <field name="tcp.flags.push" showname=".... .... 1... = Push: Set" size="1" pos="49" show="1" value="1" unmaskedvalue="18"/>
      <field name="tcp.flags.reset" showname=".... .... .0.. = Reset: Not set" size="1" pos="49" show="0" value="0" unmaskedvalue="18"/>
      <field name="tcp.flags.syn" showname=".... .... ..0. = Syn: Not set" size="1" pos="49" show="0" value="0" unmaskedvalue="18"/>
      <field name="tcp.flags.fin" showname=".... .... ...0 = Fin: Not set" size="1" pos="49" show="0" value="0" unmaskedvalue="18"/>
      <field name="tcp.flags.str" showname="TCP Flags: \xc2\xb7\xc2\xb7\xc2\xb7\xc2\xb7\xc2\xb7\xc2\xb7\xc2\xb7AP\xc2\xb7\xc2\xb7\xc2\xb7" size="2" pos="48" show="\xc2\xb7\xc2\xb7\xc2\xb7\xc2\xb7\xc2\xb7\xc2\xb7\xc2\xb7AP\xc2\xb7\xc2\xb7\xc2\xb7" value="8018"/>
    </field>
    <field name="tcp.window_size_value" showname="Window size value: 1444" size="2" pos="50" show="1444" value="05a4"/>
    <field name="tcp.window_size" showname="Calculated window size: 1444" size="2" pos="50" show="1444" value="05a4"/>
    <field name="tcp.window_size_scalefactor" showname="Window size scaling factor: -1 (unknown)" size="2" pos="50" show="-1" value="05a4"/>
    <field name="tcp.checksum" showname="Checksum: 0x528c [unverified]" size="2" pos="52" show="0x0000528c" value="528c"/>
    <field name="tcp.checksum.status" showname="Checksum Status: Unverified" size="0" pos="52" show="2"/>
    <field name="tcp.urgent_pointer" showname="Urgent pointer: 0" size="2" pos="54" show="0" value="0000"/>
    <field name="tcp.options" showname="Options: (12 bytes), No-Operation (NOP), No-Operation (NOP), Timestamps" size="12" pos="56" show="01:01:08:0a:00:0e:a3:96:f1:3c:85:9c" value="0101080a000ea396f13c859c">
      <field name="" show="No-Operation (NOP)" size="1" pos="56" value="01">
        <field name="tcp.options.type" showname="Type: 1" size="1" pos="56" show="1" value="01">
          <field name="tcp.options.type.copy" showname="0... .... = Copy on fragmentation: No" size="1" pos="56" show="0" value="0" unmaskedvalue="01"/>
          <field name="tcp.options.type.class" showname=".00. .... = Class: Control (0)" size="1" pos="56" show="0" value="0" unmaskedvalue="01"/>
          <field name="tcp.options.type.number" showname="...0 0001 = Number: No-Operation (NOP) (1)" size="1" pos="56" show="1" value="1" unmaskedvalue="01"/>
        </field>
      </field>
      <field name="" show="No-Operation (NOP)" size="1" pos="57" value="01">
        <field name="tcp.options.type" showname="Type: 1" size="1" pos="57" show="1" value="01">
          <field name="tcp.options.type.copy" showname="0... .... = Copy on fragmentation: No" size="1" pos="57" show="0" value="0" unmaskedvalue="01"/>
          <field name="tcp.options.type.class" showname=".00. .... = Class: Control (0)" size="1" pos="57" show="0" value="0" unmaskedvalue="01"/>
          <field name="tcp.options.type.number" showname="...0 0001 = Number: No-Operation (NOP) (1)" size="1" pos="57" show="1" value="1" unmaskedvalue="01"/>
        </field>
      </field>
      <field name="" show="Timestamps: TSval 959382, TSecr 4047275420" size="10" pos="58" value="080a000ea396f13c859c">
        <field name="tcp.option_kind" showname="Kind: Time Stamp Option (8)" size="1" pos="58" show="8" value="08"/>
        <field name="tcp.option_len" showname="Length: 10" size="1" pos="59" show="10" value="0a"/>
        <field name="tcp.options.timestamp.tsval" showname="Timestamp value: 959382" size="4" pos="60" show="959382" value="000ea396"/>
        <field name="tcp.options.timestamp.tsecr" showname="Timestamp echo reply: 4047275420" size="4" pos="64" show="4047275420" value="f13c859c"/>
      </field>
    </field>
    <field name="tcp.analysis" showname="SEQ/ACK analysis" size="0" pos="36" show="" value="">
      <field name="tcp.analysis.bytes_in_flight" showname="Bytes in flight: 31" size="0" pos="36" show="31"/>
      <field name="tcp.analysis.push_bytes_sent" showname="Bytes sent since last PSH flag: 31" size="0" pos="36" show="31"/>
    </field>
  </proto>
  <proto name="ssl" showname="Secure Sockets Layer" size="31" pos="68">
    <field name="ssl.record" showname="TLSv1.2 Record Layer: Encrypted Alert" size="31" pos="68" show="" value="">
      <field name="ssl.record.content_type" showname="Content Type: Alert (21)" size="1" pos="68" show="21" value="15"/>
      <field name="ssl.record.version" showname="Version: TLS 1.2 (0x0303)" size="2" pos="69" show="0x00000303" value="0303"/>
      <field name="ssl.record.length" showname="Length: 26" size="2" pos="71" show="26" value="001a"/>
      <field name="ssl.alert_message" showname="Alert Message: Encrypted Alert" size="2" pos="73" show="" value=""/>
    </field>
  </proto>
</packet>


<packet>
  <proto name="geninfo" pos="0" showname="General information" size="68">
    <field name="num" pos="0" show="2" showname="Number" value="2" size="68"/>
    <field name="len" pos="0" show="68" showname="Frame Length" value="44" size="68"/>
    <field name="caplen" pos="0" show="68" showname="Captured Length" value="44" size="68"/>
    <field name="timestamp" pos="0" show="Apr 25, 2017 06:01:32.515779678 UTC" showname="Captured Time" value="1493100092.515779678" size="68"/>
  </proto>
  <proto name="frame" showname="Frame 2: 68 bytes on wire (544 bits), 68 bytes captured (544 bits) on interface 0" size="68" pos="0">
    <field name="frame.interface_id" showname="Interface id: 0 (any)" size="0" pos="0" show="0"/>
    <field name="frame.encap_type" showname="Encapsulation type: Linux cooked-mode capture (25)" size="0" pos="0" show="25"/>
    <field name="frame.time" showname="Arrival Time: Apr 25, 2017 06:01:32.515779678 UTC" size="0" pos="0" show="Apr 25, 2017 06:01:32.515779678 UTC"/>
    <field name="frame.offset_shift" showname="Time shift for this packet: 0.000000000 seconds" size="0" pos="0" show="0.000000000"/>
    <field name="frame.time_epoch" showname="Epoch Time: 1493100092.515779678 seconds" size="0" pos="0" show="1493100092.515779678"/>
    <field name="frame.time_delta" showname="Time delta from previous captured frame: 0.000352557 seconds" size="0" pos="0" show="0.000352557"/>
    <field name="frame.time_delta_displayed" showname="Time delta from previous displayed frame: 0.000352557 seconds" size="0" pos="0" show="0.000352557"/>
    <field name="frame.time_relative" showname="Time since reference or first frame: 0.000352557 seconds" size="0" pos="0" show="0.000352557"/>
    <field name="frame.number" showname="Frame Number: 2" size="0" pos="0" show="2"/>
    <field name="frame.len" showname="Frame Length: 68 bytes (544 bits)" size="0" pos="0" show="68"/>
    <field name="frame.cap_len" showname="Capture Length: 68 bytes (544 bits)" size="0" pos="0" show="68"/>
    <field name="frame.marked" showname="Frame is marked: False" size="0" pos="0" show="0"/>
    <field name="frame.ignored" showname="Frame is ignored: False" size="0" pos="0" show="0"/>
    <field name="frame.protocols" showname="Protocols in frame: sll:ethertype:ip:tcp" size="0" pos="0" show="sll:ethertype:ip:tcp"/>
  </proto>
  <proto name="sll" showname="Linux cooked capture" size="16" pos="0">
    <field name="sll.pkttype" showname="Packet type: Sent by us (4)" size="2" pos="0" show="4" value="0004"/>
    <field name="sll.hatype" showname="Link-layer address type: 1" size="2" pos="2" show="1" value="0001"/>
    <field name="sll.halen" showname="Link-layer address length: 6" size="2" pos="4" show="6" value="0006"/>
    <field name="sll.src.eth" showname="Source: Azurewav_6b:39:52 (6c:71:d9:6b:39:52)" size="6" pos="6" show="6c:71:d9:6b:39:52" value="6c71d96b3952"/>
    <field name="sll.etype" showname="Protocol: IPv4 (0x0800)" size="2" pos="14" show="0x00000800" value="0800"/>
  </proto>
  <proto name="ip" showname="Internet Protocol Version 4, Src: 192.168.1.100, Dst: 184.84.88.78" size="20" pos="16">
    <field name="ip.version" showname="0100 .... = Version: 4" size="1" pos="16" show="4" value="4" unmaskedvalue="45"/>
    <field name="ip.hdr_len" showname=".... 0101 = Header Length: 20 bytes (5)" size="1" pos="16" show="20" value="45"/>
    <field name="ip.dsfield" showname="Differentiated Services Field: 0x00 (DSCP: CS0, ECN: Not-ECT)" size="1" pos="17" show="0x00000000" value="00">
      <field name="ip.dsfield.dscp" showname="0000 00.. = Differentiated Services Codepoint: Default (0)" size="1" pos="17" show="0" value="0" unmaskedvalue="00"/>
      <field name="ip.dsfield.ecn" showname=".... ..00 = Explicit Congestion Notification: Not ECN-Capable Transport (0)" size="1" pos="17" show="0" value="0" unmaskedvalue="00"/>
    </field>
    <field name="ip.len" showname="Total Length: 52" size="2" pos="18" show="52" value="0034"/>
    <field name="ip.id" showname="Identification: 0x35c0 (13760)" size="2" pos="20" show="0x000035c0" value="35c0"/>
    <field name="ip.flags" showname="Flags: 0x02 (Don&#x27;t Fragment)" size="1" pos="22" show="0x00000002" value="40">
      <field name="ip.flags.rb" showname="0... .... = Reserved bit: Not set" size="1" pos="22" show="0" value="40"/>
      <field name="ip.flags.df" showname=".1.. .... = Don&#x27;t fragment: Set" size="1" pos="22" show="1" value="40"/>
      <field name="ip.flags.mf" showname="..0. .... = More fragments: Not set" size="1" pos="22" show="0" value="40"/>
    </field>
    <field name="ip.frag_offset" showname="Fragment offset: 0" size="2" pos="22" show="0" value="4000"/>
    <field name="ip.ttl" showname="Time to live: 64" size="1" pos="24" show="64" value="40"/>
    <field name="ip.proto" showname="Protocol: TCP (6)" size="1" pos="25" show="6" value="06"/>
    <field name="ip.checksum" showname="Header checksum: 0x3255 [validation disabled]" size="2" pos="26" show="0x00003255" value="3255"/>
    <field name="ip.checksum.status" showname="Header checksum status: Unverified" size="0" pos="26" show="2"/>
    <field name="ip.src" showname="Source: 192.168.1.100" size="4" pos="28" show="192.168.1.100" value="c0a80164"/>
    <field name="ip.addr" showname="Source or Destination Address: 192.168.1.100" hide="yes" size="4" pos="28" show="192.168.1.100" value="c0a80164"/>
    <field name="ip.src_host" showname="Source Host: 192.168.1.100" hide="yes" size="4" pos="28" show="192.168.1.100" value="c0a80164"/>
    <field name="ip.host" showname="Source or Destination Host: 192.168.1.100" hide="yes" size="4" pos="28" show="192.168.1.100" value="c0a80164"/>
    <field name="ip.dst" showname="Destination: 184.84.88.78" size="4" pos="32" show="184.84.88.78" value="b854584e"/>
    <field name="ip.addr" showname="Source or Destination Address: 184.84.88.78" hide="yes" size="4" pos="32" show="184.84.88.78" value="b854584e"/>
    <field name="ip.dst_host" showname="Destination Host: 184.84.88.78" hide="yes" size="4" pos="32" show="184.84.88.78" value="b854584e"/>
    <field name="ip.host" showname="Source or Destination Host: 184.84.88.78" hide="yes" size="4" pos="32" show="184.84.88.78" value="b854584e"/>
    <field name="" show="Source GeoIP: Unknown" size="4" pos="28" value="c0a80164"/>
    <field name="" show="Destination GeoIP: United States, AS20940 AKAMAI-ASN1, Cambridge, MA, 42.362598, -71.084297" size="4" pos="32" value="b854584e">
      <field name="ip.geoip.dst_country" showname="Destination GeoIP Country: United States" size="4" pos="32" show="United States" value="b854584e"/>
      <field name="ip.geoip.country" showname="Source or Destination GeoIP Country: United States" hide="yes" size="4" pos="32" show="United States" value="b854584e"/>
      <field name="ip.geoip.dst_asnum" showname="Destination GeoIP AS Number: AS20940 AKAMAI-ASN1" size="4" pos="32" show="AS20940 AKAMAI-ASN1" value="b854584e"/>
      <field name="ip.geoip.asnum" showname="Source or Destination GeoIP AS Number: AS20940 AKAMAI-ASN1" hide="yes" size="4" pos="32" show="AS20940 AKAMAI-ASN1" value="b854584e"/>
      <field name="ip.geoip.dst_city" showname="Destination GeoIP City: Cambridge, MA" size="4" pos="32" show="Cambridge, MA" value="b854584e"/>
      <field name="ip.geoip.city" showname="Source or Destination GeoIP City: Cambridge, MA" hide="yes" size="4" pos="32" show="Cambridge, MA" value="b854584e"/>
      <field name="ip.geoip.dst_lat" showname="Destination GeoIP Latitude: 42.362598" size="4" pos="32" show="42.362598" value="b854584e"/>
      <field name="ip.geoip.lat" showname="Source or Destination GeoIP Latitude: 42.362598" hide="yes" size="4" pos="32" show="42.362598" value="b854584e"/>
      <field name="ip.geoip.dst_lon" showname="Destination GeoIP Longitude: -71.084297" size="4" pos="32" show="-71.084297" value="b854584e"/>
      <field name="ip.geoip.lon" showname="Source or Destination GeoIP Longitude: -71.084297" hide="yes" size="4" pos="32" show="-71.084297" value="b854584e"/>
    </field>
  </proto>
  <proto name="tcp" showname="Transmission Control Protocol, Src Port: 47442, Dst Port: 443, Seq: 32, Ack: 1, Len: 0" size="32" pos="36">
    <field name="tcp.srcport" showname="Source Port: 47442" size="2" pos="36" show="47442" value="b952"/>
    <field name="tcp.dstport" showname="Destination Port: 443" size="2" pos="38" show="443" value="01bb"/>
    <field name="tcp.port" showname="Source or Destination Port: 47442" hide="yes" size="2" pos="36" show="47442" value="b952"/>
    <field name="tcp.port" showname="Source or Destination Port: 443" hide="yes" size="2" pos="38" show="443" value="01bb"/>
    <field name="tcp.stream" showname="Stream index: 0" size="0" pos="36" show="0"/>
    <field name="tcp.len" showname="TCP Segment Len: 0" size="1" pos="48" show="0" value="80"/>
    <field name="tcp.seq" showname="Sequence number: 32    (relative sequence number)" size="4" pos="40" show="32" value="95676b87"/>
    <field name="tcp.ack" showname="Acknowledgment number: 1    (relative ack number)" size="4" pos="44" show="1" value="48f536ea"/>
    <field name="tcp.hdr_len" showname="Header Length: 32 bytes" size="1" pos="48" show="32" value="80"/>
    <field name="tcp.flags" showname="Flags: 0x011 (FIN, ACK)" size="2" pos="48" show="0x00000011" value="11" unmaskedvalue="8011">
      <field name="tcp.flags.res" showname="000. .... .... = Reserved: Not set" size="1" pos="48" show="0" value="0" unmaskedvalue="80"/>
      <field name="tcp.flags.ns" showname="...0 .... .... = Nonce: Not set" size="1" pos="48" show="0" value="0" unmaskedvalue="80"/>
      <field name="tcp.flags.cwr" showname=".... 0... .... = Congestion Window Reduced (CWR): Not set" size="1" pos="49" show="0" value="0" unmaskedvalue="11"/>
      <field name="tcp.flags.ecn" showname=".... .0.. .... = ECN-Echo: Not set" size="1" pos="49" show="0" value="0" unmaskedvalue="11"/>
      <field name="tcp.flags.urg" showname=".... ..0. .... = Urgent: Not set" size="1" pos="49" show="0" value="0" unmaskedvalue="11"/>
      <field name="tcp.flags.ack" showname=".... ...1 .... = Acknowledgment: Set" size="1" pos="49" show="1" value="1" unmaskedvalue="11"/>
      <field name="tcp.flags.push" showname=".... .... 0... = Push: Not set" size="1" pos="49" show="0" value="0" unmaskedvalue="11"/>
      <field name="tcp.flags.reset" showname=".... .... .0.. = Reset: Not set" size="1" pos="49" show="0" value="0" unmaskedvalue="11"/>
      <field name="tcp.flags.syn" showname=".... .... ..0. = Syn: Not set" size="1" pos="49" show="0" value="0" unmaskedvalue="11"/>
      <field name="tcp.flags.fin" showname=".... .... ...1 = Fin: Set" size="1" pos="49" show="1" value="1" unmaskedvalue="11">
        <field name="_ws.expert" showname="Expert Info (Chat/Sequence): Connection finish (FIN)" size="0" pos="49">
          <field name="tcp.connection.fin" showname="Connection finish (FIN)" size="0" pos="0" show="" value=""/>
          <field name="_ws.expert.message" showname="Message: Connection finish (FIN)" hide="yes" size="0" pos="0" show="Connection finish (FIN)"/>
          <field name="_ws.expert.severity" showname="Severity level: Chat" size="0" pos="0" show="2097152"/>
          <field name="_ws.expert.group" showname="Group: Sequence" size="0" pos="0" show="33554432"/>
        </field>
      </field>
      <field name="tcp.flags.str" showname="TCP Flags: \xc2\xb7\xc2\xb7\xc2\xb7\xc2\xb7\xc2\xb7\xc2\xb7\xc2\xb7A\xc2\xb7\xc2\xb7\xc2\xb7F" size="2" pos="48" show="\xc2\xb7\xc2\xb7\xc2\xb7\xc2\xb7\xc2\xb7\xc2\xb7\xc2\xb7A\xc2\xb7\xc2\xb7\xc2\xb7F" value="8011"/>
    </field>
    <field name="tcp.window_size_value" showname="Window size value: 1444" size="2" pos="50" show="1444" value="05a4"/>
    <field name="tcp.window_size" showname="Calculated window size: 1444" size="2" pos="50" show="1444" value="05a4"/>
    <field name="tcp.window_size_scalefactor" showname="Window size scaling factor: -1 (unknown)" size="2" pos="50" show="-1" value="05a4"/>
    <field name="tcp.checksum" showname="Checksum: 0x480f [unverified]" size="2" pos="52" show="0x0000480f" value="480f"/>
    <field name="tcp.checksum.status" showname="Checksum Status: Unverified" size="0" pos="52" show="2"/>
    <field name="tcp.urgent_pointer" showname="Urgent pointer: 0" size="2" pos="54" show="0" value="0000"/>
    <field name="tcp.options" showname="Options: (12 bytes), No-Operation (NOP), No-Operation (NOP), Timestamps" size="12" pos="56" show="01:01:08:0a:00:0e:a3:96:f1:3c:85:9c" value="0101080a000ea396f13c859c">
      <field name="" show="No-Operation (NOP)" size="1" pos="56" value="01">
        <field name="tcp.options.type" showname="Type: 1" size="1" pos="56" show="1" value="01">
          <field name="tcp.options.type.copy" showname="0... .... = Copy on fragmentation: No" size="1" pos="56" show="0" value="0" unmaskedvalue="01"/>
          <field name="tcp.options.type.class" showname=".00. .... = Class: Control (0)" size="1" pos="56" show="0" value="0" unmaskedvalue="01"/>
          <field name="tcp.options.type.number" showname="...0 0001 = Number: No-Operation (NOP) (1)" size="1" pos="56" show="1" value="1" unmaskedvalue="01"/>
        </field>
      </field>
      <field name="" show="No-Operation (NOP)" size="1" pos="57" value="01">
        <field name="tcp.options.type" showname="Type: 1" size="1" pos="57" show="1" value="01">
          <field name="tcp.options.type.copy" showname="0... .... = Copy on fragmentation: No" size="1" pos="57" show="0" value="0" unmaskedvalue="01"/>
          <field name="tcp.options.type.class" showname=".00. .... = Class: Control (0)" size="1" pos="57" show="0" value="0" unmaskedvalue="01"/>
          <field name="tcp.options.type.number" showname="...0 0001 = Number: No-Operation (NOP) (1)" size="1" pos="57" show="1" value="1" unmaskedvalue="01"/>
        </field>
      </field>
      <field name="" show="Timestamps: TSval 959382, TSecr 4047275420" size="10" pos="58" value="080a000ea396f13c859c">
        <field name="tcp.option_kind" showname="Kind: Time Stamp Option (8)" size="1" pos="58" show="8" value="08"/>
        <field name="tcp.option_len" showname="Length: 10" size="1" pos="59" show="10" value="0a"/>
        <field name="tcp.options.timestamp.tsval" showname="Timestamp value: 959382" size="4" pos="60" show="959382" value="000ea396"/>
        <field name="tcp.options.timestamp.tsecr" showname="Timestamp echo reply: 4047275420" size="4" pos="64" show="4047275420" value="f13c859c"/>
      </field>
    </field>
  </proto>
</packet>


<packet>
  <proto name="geninfo" pos="0" showname="General information" size="99">
    <field name="num" pos="0" show="3" showname="Number" value="3" size="99"/>
    <field name="len" pos="0" show="99" showname="Frame Length" value="63" size="99"/>
    <field name="caplen" pos="0" show="99" showname="Captured Length" value="63" size="99"/>
    <field name="timestamp" pos="0" show="Apr 25, 2017 06:01:32.515963622 UTC" showname="Captured Time" value="1493100092.515963622" size="99"/>
  </proto>
  <proto name="frame" showname="Frame 3: 99 bytes on wire (792 bits), 99 bytes captured (792 bits) on interface 0" size="99" pos="0">
    <field name="frame.interface_id" showname="Interface id: 0 (any)" size="0" pos="0" show="0"/>
    <field name="frame.encap_type" showname="Encapsulation type: Linux cooked-mode capture (25)" size="0" pos="0" show="25"/>
    <field name="frame.time" showname="Arrival Time: Apr 25, 2017 06:01:32.515963622 UTC" size="0" pos="0" show="Apr 25, 2017 06:01:32.515963622 UTC"/>
    <field name="frame.offset_shift" showname="Time shift for this packet: 0.000000000 seconds" size="0" pos="0" show="0.000000000"/>
    <field name="frame.time_epoch" showname="Epoch Time: 1493100092.515963622 seconds" size="0" pos="0" show="1493100092.515963622"/>
    <field name="frame.time_delta" showname="Time delta from previous captured frame: 0.000183944 seconds" size="0" pos="0" show="0.000183944"/>
    <field name="frame.time_delta_displayed" showname="Time delta from previous displayed frame: 0.000183944 seconds" size="0" pos="0" show="0.000183944"/>
    <field name="frame.time_relative" showname="Time since reference or first frame: 0.000536501 seconds" size="0" pos="0" show="0.000536501"/>
    <field name="frame.number" showname="Frame Number: 3" size="0" pos="0" show="3"/>
    <field name="frame.len" showname="Frame Length: 99 bytes (792 bits)" size="0" pos="0" show="99"/>
    <field name="frame.cap_len" showname="Capture Length: 99 bytes (792 bits)" size="0" pos="0" show="99"/>
    <field name="frame.marked" showname="Frame is marked: False" size="0" pos="0" show="0"/>
    <field name="frame.ignored" showname="Frame is ignored: False" size="0" pos="0" show="0"/>
    <field name="frame.protocols" showname="Protocols in frame: sll:ethertype:ip:tcp:ssl" size="0" pos="0" show="sll:ethertype:ip:tcp:ssl"/>
  </proto>
  <proto name="sll" showname="Linux cooked capture" size="16" pos="0">
    <field name="sll.pkttype" showname="Packet type: Sent by us (4)" size="2" pos="0" show="4" value="0004"/>
    <field name="sll.hatype" showname="Link-layer address type: 1" size="2" pos="2" show="1" value="0001"/>
    <field name="sll.halen" showname="Link-layer address length: 6" size="2" pos="4" show="6" value="0006"/>
    <field name="sll.src.eth" showname="Source: Azurewav_6b:39:52 (6c:71:d9:6b:39:52)" size="6" pos="6" show="6c:71:d9:6b:39:52" value="6c71d96b3952"/>
    <field name="sll.etype" showname="Protocol: IPv4 (0x0800)" size="2" pos="14" show="0x00000800" value="0800"/>
  </proto>
  <proto name="ip" showname="Internet Protocol Version 4, Src: 192.168.1.100, Dst: 184.84.88.78" size="20" pos="16">
    <field name="ip.version" showname="0100 .... = Version: 4" size="1" pos="16" show="4" value="4" unmaskedvalue="45"/>
    <field name="ip.hdr_len" showname=".... 0101 = Header Length: 20 bytes (5)" size="1" pos="16" show="20" value="45"/>
    <field name="ip.dsfield" showname="Differentiated Services Field: 0x00 (DSCP: CS0, ECN: Not-ECT)" size="1" pos="17" show="0x00000000" value="00">
      <field name="ip.dsfield.dscp" showname="0000 00.. = Differentiated Services Codepoint: Default (0)" size="1" pos="17" show="0" value="0" unmaskedvalue="00"/>
      <field name="ip.dsfield.ecn" showname=".... ..00 = Explicit Congestion Notification: Not ECN-Capable Transport (0)" size="1" pos="17" show="0" value="0" unmaskedvalue="00"/>
    </field>
    <field name="ip.len" showname="Total Length: 83" size="2" pos="18" show="83" value="0053"/>
    <field name="ip.id" showname="Identification: 0x9c7e (40062)" size="2" pos="20" show="0x00009c7e" value="9c7e"/>
    <field name="ip.flags" showname="Flags: 0x02 (Don&#x27;t Fragment)" size="1" pos="22" show="0x00000002" value="40">
      <field name="ip.flags.rb" showname="0... .... = Reserved bit: Not set" size="1" pos="22" show="0" value="40"/>
      <field name="ip.flags.df" showname=".1.. .... = Don&#x27;t fragment: Set" size="1" pos="22" show="1" value="40"/>
      <field name="ip.flags.mf" showname="..0. .... = More fragments: Not set" size="1" pos="22" show="0" value="40"/>
    </field>
    <field name="ip.frag_offset" showname="Fragment offset: 0" size="2" pos="22" show="0" value="4000"/>
    <field name="ip.ttl" showname="Time to live: 64" size="1" pos="24" show="64" value="40"/>
    <field name="ip.proto" showname="Protocol: TCP (6)" size="1" pos="25" show="6" value="06"/>
    <field name="ip.checksum" showname="Header checksum: 0xcb77 [validation disabled]" size="2" pos="26" show="0x0000cb77" value="cb77"/>
    <field name="ip.checksum.status" showname="Header checksum status: Unverified" size="0" pos="26" show="2"/>
    <field name="ip.src" showname="Source: 192.168.1.100" size="4" pos="28" show="192.168.1.100" value="c0a80164"/>
    <field name="ip.addr" showname="Source or Destination Address: 192.168.1.100" hide="yes" size="4" pos="28" show="192.168.1.100" value="c0a80164"/>
    <field name="ip.src_host" showname="Source Host: 192.168.1.100" hide="yes" size="4" pos="28" show="192.168.1.100" value="c0a80164"/>
    <field name="ip.host" showname="Source or Destination Host: 192.168.1.100" hide="yes" size="4" pos="28" show="192.168.1.100" value="c0a80164"/>
    <field name="ip.dst" showname="Destination: 184.84.88.78" size="4" pos="32" show="184.84.88.78" value="b854584e"/>
    <field name="ip.addr" showname="Source or Destination Address: 184.84.88.78" hide="yes" size="4" pos="32" show="184.84.88.78" value="b854584e"/>
    <field name="ip.dst_host" showname="Destination Host: 184.84.88.78" hide="yes" size="4" pos="32" show="184.84.88.78" value="b854584e"/>
    <field name="ip.host" showname="Source or Destination Host: 184.84.88.78" hide="yes" size="4" pos="32" show="184.84.88.78" value="b854584e"/>
    <field name="" show="Source GeoIP: Unknown" size="4" pos="28" value="c0a80164"/>
    <field name="" show="Destination GeoIP: United States, AS20940 AKAMAI-ASN1, Cambridge, MA, 42.362598, -71.084297" size="4" pos="32" value="b854584e">
      <field name="ip.geoip.dst_country" showname="Destination GeoIP Country: United States" size="4" pos="32" show="United States" value="b854584e"/>
      <field name="ip.geoip.country" showname="Source or Destination GeoIP Country: United States" hide="yes" size="4" pos="32" show="United States" value="b854584e"/>
      <field name="ip.geoip.dst_asnum" showname="Destination GeoIP AS Number: AS20940 AKAMAI-ASN1" size="4" pos="32" show="AS20940 AKAMAI-ASN1" value="b854584e"/>
      <field name="ip.geoip.asnum" showname="Source or Destination GeoIP AS Number: AS20940 AKAMAI-ASN1" hide="yes" size="4" pos="32" show="AS20940 AKAMAI-ASN1" value="b854584e"/>
      <field name="ip.geoip.dst_city" showname="Destination GeoIP City: Cambridge, MA" size="4" pos="32" show="Cambridge, MA" value="b854584e"/>
      <field name="ip.geoip.city" showname="Source or Destination GeoIP City: Cambridge, MA" hide="yes" size="4" pos="32" show="Cambridge, MA" value="b854584e"/>
      <field name="ip.geoip.dst_lat" showname="Destination GeoIP Latitude: 42.362598" size="4" pos="32" show="42.362598" value="b854584e"/>
      <field name="ip.geoip.lat" showname="Source or Destination GeoIP Latitude: 42.362598" hide="yes" size="4" pos="32" show="42.362598" value="b854584e"/>
      <field name="ip.geoip.dst_lon" showname="Destination GeoIP Longitude: -71.084297" size="4" pos="32" show="-71.084297" value="b854584e"/>
      <field name="ip.geoip.lon" showname="Source or Destination GeoIP Longitude: -71.084297" hide="yes" size="4" pos="32" show="-71.084297" value="b854584e"/>
    </field>
  </proto>
  <proto name="tcp" showname="Transmission Control Protocol, Src Port: 47440, Dst Port: 443, Seq: 1, Ack: 1, Len: 31" size="32" pos="36">
    <field name="tcp.srcport" showname="Source Port: 47440" size="2" pos="36" show="47440" value="b950"/>
    <field name="tcp.dstport" showname="Destination Port: 443" size="2" pos="38" show="443" value="01bb"/>
    <field name="tcp.port" showname="Source or Destination Port: 47440" hide="yes" size="2" pos="36" show="47440" value="b950"/>
    <field name="tcp.port" showname="Source or Destination Port: 443" hide="yes" size="2" pos="38" show="443" value="01bb"/>
    <field name="tcp.stream" showname="Stream index: 1" size="0" pos="36" show="1"/>
    <field name="tcp.len" showname="TCP Segment Len: 31" size="1" pos="48" show="31" value="80"/>
    <field name="tcp.seq" showname="Sequence number: 1    (relative sequence number)" size="4" pos="40" show="1" value="f7ac0e3a"/>
    <field name="tcp.nxtseq" showname="Next sequence number: 32    (relative sequence number)" size="0" pos="36" show="32"/>
    <field name="tcp.ack" showname="Acknowledgment number: 1    (relative ack number)" size="4" pos="44" show="1" value="480529b2"/>
    <field name="tcp.hdr_len" showname="Header Length: 32 bytes" size="1" pos="48" show="32" value="80"/>
    <field name="tcp.flags" showname="Flags: 0x018 (PSH, ACK)" size="2" pos="48" show="0x00000018" value="18" unmaskedvalue="8018">
      <field name="tcp.flags.res" showname="000. .... .... = Reserved: Not set" size="1" pos="48" show="0" value="0" unmaskedvalue="80"/>
      <field name="tcp.flags.ns" showname="...0 .... .... = Nonce: Not set" size="1" pos="48" show="0" value="0" unmaskedvalue="80"/>
      <field name="tcp.flags.cwr" showname=".... 0... .... = Congestion Window Reduced (CWR): Not set" size="1" pos="49" show="0" value="0" unmaskedvalue="18"/>
